{"schema_version":"RTS-ASSET-MANIFEST-V1","snapshot_version":2,"generated_at":"2026-07-24T23:00:00Z","source_refs":["asset_manifest/snapshots/v001.json","nobutakayamauchi/RTS@cf3782619fdb455087ee574d7570d607c941bc58:outcome_evidence/","nobutakayamauchi/RTS@2f5c9e8f7db27492e61b6dc11dfb17a708c60c6b:skill_regression/","nobutakayamauchi/RTS-Skills-@66991529519795e62d61874d6a6197ae14e01967:rts-skills/manifests/skill_promotion_review.skill.yaml"],"repositories":[{"repository":"nobutakayamauchi/AIX","visibility":"private","default_branch":"main","observed_ref":"main","role":"Trading research scaffold","lifecycle_status":"FREEZE / TRADING-LAB / DO NOT ACTIVATE","canonical_responsibility":"Execution-aware EV research","allowed_reuse_boundary":"Private metadata only; keep outside RTS business/product line","safe_metadata_only":true,"evidence_refs":["docs/ecosystem/REPO_MAP.md"]},{"repository":"nobutakayamauchi/RTS","visibility":"public","default_branch":"main","observed_ref":"main","role":"Canonical protocol / structural ledger","lifecycle_status":"ACTIVE / CANON","canonical_responsibility":"Canonical decision, evidence, governance and reconstruction records","allowed_reuse_boundary":"Reference through schemas and documented contracts; do not absorb adjacent runtime behavior.","safe_metadata_only":false,"evidence_refs":["docs/ecosystem/REPO_MAP.md"]},{"repository":"nobutakayamauchi/RTS-AGE","visibility":"public","default_branch":"main","observed_ref":"main","role":"Agentic Gateway & Execution Lab","lifecycle_status":"RESCUE / GATEWAY","canonical_responsibility":"Provider adapters, dry-runs, patch and validation proposals","allowed_reuse_boundary":"Adapt bounded implementation assets; never treat as canonical RTS records","safe_metadata_only":false,"evidence_refs":["docs/overview/POSITION.md"]},{"repository":"nobutakayamauchi/RTS-Design-Research","visibility":"public","default_branch":"main","observed_ref":"main","role":"Design research extension","lifecycle_status":"PARTS / DESIGN-LAYER","canonical_responsibility":"Design evidence and decision artifacts","allowed_reuse_boundary":"Reference/adapt design contracts; no raw inspiration dump","safe_metadata_only":false,"evidence_refs":["README.md"]},{"repository":"nobutakayamauchi/RTS-Hermes-Drive","visibility":"public","default_branch":"main","observed_ref":"main","role":"Orchestration bridge","lifecycle_status":"PARTS / ORCHESTRATION","canonical_responsibility":"Trigger, dispatch and result handoff contracts","allowed_reuse_boundary":"Adapt thin orchestration interfaces; avoid runtime lock-in","safe_metadata_only":false,"evidence_refs":["docs/overview/POSITION.md"]},{"repository":"nobutakayamauchi/RTS-MCP-Packs","visibility":"public","default_branch":"main","observed_ref":"main","role":"Connector pack definitions","lifecycle_status":"PARTS / CONNECTOR-PACKS","canonical_responsibility":"Connector capability and permission bundles","allowed_reuse_boundary":"Reference/adapt pack metadata; never store credentials","safe_metadata_only":false,"evidence_refs":["docs/overview/POSITION.md"]},{"repository":"nobutakayamauchi/RTS-Minimal-Runtime","visibility":"public","default_branch":"main","observed_ref":"main","role":"Minimal reference runtime","lifecycle_status":"ACTIVE / REFERENCE","canonical_responsibility":"Smallest intent-to-reconstruction proof","allowed_reuse_boundary":"Reference implementation only; keep minimal","safe_metadata_only":false,"evidence_refs":["README.md"]},{"repository":"nobutakayamauchi/RTS-Signal-Feeds","visibility":"public","default_branch":"main","observed_ref":"main","role":"Signal skeleton","lifecycle_status":"FREEZE / SIGNAL-SKELETON / REVIEW BEFORE USE","canonical_responsibility":"Candidate signal classification and routing","allowed_reuse_boundary":"Reference-only; no live scraping or publishing","safe_metadata_only":false,"evidence_refs":["README.md"]},{"repository":"nobutakayamauchi/RTS-Skills-","visibility":"public","default_branch":"main","observed_ref":"main","role":"Reusable operational skills","lifecycle_status":"PARTS / SKILLS","canonical_responsibility":"Canonical reusable skill definitions","allowed_reuse_boundary":"Direct/adapt reuse under explicit skill contracts","safe_metadata_only":false,"evidence_refs":["README.md"]},{"repository":"nobutakayamauchi/RTS-Talent-Registry","visibility":"public","default_branch":"main","observed_ref":"main","role":"Governance registry concept","lifecycle_status":"FREEZE / GOVERNANCE-REGISTRY / REVIEW BEFORE USE","canonical_responsibility":"External tool/skill candidate governance","allowed_reuse_boundary":"Reference-only; do not activate personal-data registry","safe_metadata_only":false,"evidence_refs":["README.md"]},{"repository":"nobutakayamauchi/RTS-minicompany","visibility":"private","default_branch":"main","observed_ref":"main","role":"Solo business operation MVP","lifecycle_status":"ACTIVE / MONEY-LINE","canonical_responsibility":"Human-gated business workflow and trace evidence","allowed_reuse_boundary":"Private metadata only; no customer/lead/output bodies","safe_metadata_only":true,"evidence_refs":["docs/ecosystem/REPO_MAP.md"]},{"repository":"nobutakayamauchi/codex-connector-test","visibility":"public","default_branch":"main","observed_ref":"main","role":"Connector test sandbox","lifecycle_status":"ARCHIVE / TEST-FIXTURE / REVIEW ONLY","canonical_responsibility":"Minimal connector fixture","allowed_reuse_boundary":"No production reuse except explicit connector testing","safe_metadata_only":false,"evidence_refs":["README.md"]},{"repository":"nobutakayamauchi/nobutakayamauchi","visibility":"public","default_branch":"main","observed_ref":"main","role":"Public profile surface","lifecycle_status":"ACTIVE / PROFILE","canonical_responsibility":"Operator profile and ecosystem entry point","allowed_reuse_boundary":"Reference positioning only","safe_metadata_only":false,"evidence_refs":["README.md"]},{"repository":"nobutakayamauchi/rts-dev-protocol","visibility":"public","default_branch":"main","observed_ref":"main","role":"Development doctrine shelf","lifecycle_status":"PARTS / DOCTRINE","canonical_responsibility":"AI implementation, PR and rescue procedures","allowed_reuse_boundary":"Reference-only until promoted into a concrete workflow","safe_metadata_only":false,"evidence_refs":["README.md"]},{"repository":"nobutakayamauchi/rts-lite","visibility":"public","default_branch":"main","observed_ref":"main","role":"Empty lightweight placeholder","lifecycle_status":"INACTIVE / EMPTY PLACEHOLDER / REVIEW ONLY","canonical_responsibility":"No canonical capability","allowed_reuse_boundary":"Do not develop; use RTS-Minimal-Runtime","safe_metadata_only":false,"evidence_refs":["README.md"]},{"repository":"nobutakayamauchi/rts-video-flow","visibility":"public","default_branch":"main","observed_ref":"main","role":"Video workflow prototype","lifecycle_status":"FREEZE / VIDEO-WORKFLOW / REVIEW BEFORE USE","canonical_responsibility":"Video processing scaffold","allowed_reuse_boundary":"Reference/adapt only after concrete review","safe_metadata_only":false,"evidence_refs":["README.md"]},{"repository":"nobutakayamauchi/rts01-offer","visibility":"public","default_branch":"main","observed_ref":"main","role":"Static offer landing page","lifecycle_status":"ACTIVE / SALES-LP","canonical_responsibility":"External sales surface","allowed_reuse_boundary":"Reference offer wording only; not delivery logic","safe_metadata_only":false,"evidence_refs":["README.md"]},{"repository":"nobutakayamauchi/ryoushuushotesutoyou","visibility":"private","default_branch":"main","observed_ref":"main","role":"One-off private test","lifecycle_status":"PRIVATE TEST / REVIEW ONLY","canonical_responsibility":"Receipt/output test metadata","allowed_reuse_boundary":"Private metadata only; no content reuse","safe_metadata_only":true,"evidence_refs":["docs/ecosystem/PROJECT_REGISTRY.md"]},{"repository":"nobutakayamauchi/seminar-compass","visibility":"public","default_branch":"main","observed_ref":"main","role":"Learning reconstruction product candidate","lifecycle_status":"ACTIVE / PRODUCT","canonical_responsibility":"Learning reconstruction pipeline","allowed_reuse_boundary":"Independent product; reuse only through explicit contracts","safe_metadata_only":false,"evidence_refs":["README.md"]}],"assets":[{"asset_id":"RTS-AM-A0001","repository":"nobutakayamauchi/RTS","locator":"freezer/","kind":"code","capability":"deferred-work-governance","source_ref":"main","canonicality":"CANONICAL","reuse_mode":"DIRECT","license_status":"COMPATIBLE","sensitivity":"PUBLIC","consumer_candidates":["RTS-Hermes-Drive"],"notes":"FREEZER, build assessment, Preflight and WIP=1 selection boundary.","risks":[],"evidence_refs":["freezer/README.md"]},{"asset_id":"RTS-AM-A0002","repository":"nobutakayamauchi/RTS","locator":"schemas/execution_record.schema.yaml","kind":"schema","capability":"execution-record-contract","source_ref":"main","canonicality":"CANONICAL","reuse_mode":"DIRECT","license_status":"COMPATIBLE","sensitivity":"PUBLIC","consumer_candidates":["RTS-Hermes-Drive","RTS-AGE"],"notes":"","risks":[],"evidence_refs":["docs/overview/EXECUTION_AND_EVIDENCE.md"]},{"asset_id":"RTS-AM-A0003","repository":"nobutakayamauchi/RTS","locator":"schemas/evidence_ref.schema.yaml","kind":"schema","capability":"evidence-reference-contract","source_ref":"main","canonicality":"CANONICAL","reuse_mode":"DIRECT","license_status":"COMPATIBLE","sensitivity":"PUBLIC","consumer_candidates":["RTS-Hermes-Drive","RTS-AGE"],"notes":"","risks":[],"evidence_refs":["docs/overview/EXECUTION_AND_EVIDENCE.md"]},{"asset_id":"RTS-AM-A0004","repository":"nobutakayamauchi/RTS","locator":"rts_kernel/state_engine.py","kind":"code","capability":"legacy-repository-state-detection","source_ref":"main","canonicality":"REFERENCE","reuse_mode":"ADAPT","license_status":"COMPATIBLE","sensitivity":"PUBLIC","consumer_candidates":["RTS-Hermes-Drive"],"notes":"Legacy/repair-required; do not promote without contract alignment.